<?xml version="1.0" encoding="utf-8"?>
<xs:schema targetNamespace="http://tempuri.org/XMLSchema.xsd"
    elementFormDefault="qualified"
    xmlns="http://tempuri.org/XMLSchema.xsd"
    xmlns:mstns="http://tempuri.org/XMLSchema.xsd"
    xmlns:xs="http://www.w3.org/2001/XMLSchema">

	<xs:element name ="NationalParks">
		<xs:complexType>
			<xs:sequence>
				<xs:element name ="NationalPark" maxOccurs="unbounded">
					<xs:complexType>
						<xs:sequence>
							<xs:element name="ParkName" type="xs:string"/>

							<xs:element name="Phone" type ="xs:string" maxOccurs="unbounded"/>

							<xs:element name ="Address">
								<xs:complexType>
									<xs:sequence>
										<xs:element name="Number"    type="xs:integer"/>
										<xs:element name="Street"	 type ="xs:string"/>
										<xs:element name="City"      type ="xs:string"/>
										<xs:element name="State"	 type ="xs:string"/>
										<xs:element name="Zipcode"   type ="xs:string"/>
										<xs:element name="NearestAirport" type="xs:string" minOccurs="0"/>
									</xs:sequence>
								</xs:complexType>
							</xs:element>

							<xs:element name ="Rating" type="xs:decimal" minOccurs =" 0"/>
								
						</xs:sequence>
					</xs:complexType>
				</xs:element>
			</xs:sequence>
		</xs:complexType>

	</xs:element>

</xs:schema>
